{
  "id": "six-week-engagement",
  "name": "6-Week Engagement Program",
  "description": "A comprehensive 6-week fitness program designed specifically for engagement photo preparation. Combines strength training, conditioning, and mobility work to help you look and feel your best for your special day.",
  "version": "1.0.0",
  "author": {
    "name": "Fitness Team",
    "email": "team@example.com",
    "website": "https://example.com"
  },
  "duration": {
    "weeks": 6,
    "daysPerWeek": 7,
    "estimatedDuration": "45-60 minutes"
  },
  "difficulty": "intermediate",
  "targetAudience": [
    "engagement-prep",
    "general-fitness",
    "muscle-gain"
  ],
  "equipment": {
    "required": [
      "gym-access",
      "dumbbells",
      "barbell",
      "bench"
    ],
    "optional": [
      "kettlebell",
      "resistance-bands",
      "foam-roller"
    ],
    "alternatives": {
      "barbell": ["dumbbells", "resistance-bands"],
      "bench": ["stability-ball", "floor"],
      "gym-access": ["home-gym-setup"]
    }
  },
  "settings": {
    "autoProgression": true,
    "restTimers": true,
    "unitSystem": "imperial",
    "trackingFields": ["weight", "reps", "time", "notes"]
  },
  "tags": [
    "engagement",
    "6-week",
    "strength-training",
    "conditioning",
    "intermediate",
    "gym-home-hybrid"
  ],
  "created": "2024-01-01T00:00:00Z",
  "lastModified": "2024-01-01T00:00:00Z"
}